{
  "allowed_actions": [
    "escalate_to_human",
    "collect_more_evidence"
  ],
  "cause_category": "invalid_command",
  "description": "Синтетический статус после ошибки запуска",
  "fixture_kind": "handcrafted_synthetic",
  "forbidden_actions": [
    "restart_workload",
    "rollback_deployment"
  ],
  "scenario_id": "crashloop-bad-command",
  "should_detect": true
}
